1	KINTOKI鶴見店	https://kintoki02.lp-dokidoki.com	KINTOKI鶴見店 パチンコ スロット 神奈川県 横浜市 鶴見区 佃野町	KINTOKI鶴見店 神奈川県横浜市鶴見区佃野町22-6 地域密着!楽しいお届けいたします！	https://kintoki02.lp-dokidoki.com/img/kintoki02.jpg
2	KINTOKI蒲田東口店	https://kintoki03.lp-dokidoki.com	KINTOKI蒲田東口店 パチンコ スロット 東京都 大田区 蒲田	KINTOKI蒲田東口店 東京都大田区蒲田5-16-7 JR蒲田駅東口駅前徒歩7秒! 地域密着!楽しいをお届けいたします！	https://kintoki03.lp-dokidoki.com/img/kintoki03.jpg
3	KINTOKI京急蒲田店	https://kintoki01.lp-dokidoki.com	KINTOKI京急蒲田店 パチンコ スロット 東京都 大田区 蒲田	KINTOKI京急蒲田店 東京都大田区蒲田4丁目6番4号 地域密着!楽しいお届けいたします！	https://kintoki01.lp-dokidoki.com/img/kintoki01.jpg
4	KINTOKI大森東口店	https://kintoki04.lp-dokidoki.com	KINTOKI大森東口店 パチンコ スロット 東京都 大田区 大森北	KINTOKI大森東口店 東京都大田区大森北1-4-4 JJR大森駅・東口・徒歩0分! 地域密着!楽しいをお届けいたします！	https://kintoki04.lp-dokidoki.com/img/kintoki04.jpg
5	VEGA千葉南店	https://vc.lp-dokidoki.com	VEGA 千葉南  千葉県 千葉市 椎名崎 1170　最新台　パチンコ　スロット	VEGA千葉南店　千葉県千葉市椎名崎1170　電話：043-209-9009  パチンコ　スロット	https://vc.lp-dokidoki.com/img/vc.jpg
6	マルマン吉野店	https://maruman01.lp-dokidoki.com	マルマン吉野店　パチンコ　スロット 奈良県 吉野郡 大淀町 下渕	マルマン吉野店　奈良県吉野郡大淀町下渕1555-4　パチンコ・スロット地域密着の楽しさをお届け致します。	https://maruman01.lp-dokidoki.com/img/maruman01.jpg
7	クィーンラスベガス	https://queen.lp-dokidoki.com	クィーンラスベガス パチンコ スロット 福岡県 北九州市 八幡西区 里中	クィーンラスベガス 福岡県北九州市八幡西区里中3-4-5 地域密着!楽しいお届けいたします！	https://queen.lp-dokidoki.com/img/queen.jpg
8	アプラウズ	https://applause01.lp-dokidoki.com	アプラウズ パチンコ スロット 福岡県 直方市 大字知古	アプラウズ 福岡県直方市大字知古1382番地19 地域密着!楽しいお届けいたします！	https://applause01.lp-dokidoki.com/img/applause01.jpg
9	DASH葛原店	https://dash-k.lp-dokidoki.com	ダッシュ葛原店　パチンコ　スロット　北九州市　小倉南区　葛原	DASH葛原店　福岡県北九州市小倉南区葛原東1丁目4-1　パチンコ　スロット　楽しさいっぱい！	https://dash-k.lp-dokidoki.com/img/dash-k.jpg
